{
  "id": "dna_conformance_minimal",
  "version": 1,
  "previous_hash": "none",
  "organization_id": "org_conformance",
  "status": "draft",
  "created_at": "2026-10-03T00:00:00Z",
  "identity": {
    "name": "Conformance Bakery",
    "elevator_pitch": "A minimal valid card for cross-implementation checks."
  },
  "voice": {
    "tone": [
      "warm",
      "unhurried"
    ],
    "sample_phrases": [
      "Fresh bread daily.",
      "Come on in.",
      "Baked this morning."
    ]
  },
  "offerings": [
    {
      "name": "Sourdough loaf",
      "kind": "bakery",
      "orderable": true,
      "price": null,
      "confidence": 1.0
    }
  ],
  "operations": {
    "hours": "Mon-Fri 7am-3pm",
    "channels": [
      "walk-in",
      "phone"
    ]
  },
  "field_provenance": {
    "identity.name": {
      "sources": [
        "fixture"
      ],
      "confidence": 1.0,
      "extractor_agent": "conformance",
      "extracted_at": "2026-10-03T00:00:00Z"
    }
  },
  "changelog": [],
  "acting_hash": "d81d2e2ec5a50c2d9f4943f3687af4b06478b38a402f3151c1fa480fdc0ed0d0",
  "hash": "e0cbbf3eb57b55bfc961f0f361705f8907d149969598c02e78fa78a09bef2fc1",
  "previous_version": null
}